video_id,title,publishedAt,channelId,channelTitle,categoryId,trending_date,tags,view_count,likes,dislikes,comment_count,thumbnail_link,comments_disabled,ratings_disabled,description
"0hAL7emClFM","BILL & TED FACE THE MUSIC Official Trailer #1 (2020)","2020-06-09T13:00:07Z","UCt4Xdx38tkV5_3IkOJAFw-Q","Orion Pictures","1","20.10.06","[none]","3179360","47455","1358","4598","https://i.ytimg.com/vi/0hAL7emClFM/default.jpg","False","False","Whoa. The wait is finally over, dudes! Keanu Reeves and Alex Winter star in the first official trailer for Bill & Ted Face the Music! Watch now! And remember: be excellent to each other. 🎸⚡ #BillAndTed3 #FaceTheMusic #BillAndTedDay"
"x8K6L1wr7fs","Destiny 2 Reveal - 6/9 @ 9am Pacific","2020-06-09T16:45:04Z","UCxidp0WgNPBdIXpHZKQcoMw","Bungie","20","20.10.06","[none]","831619","0","0","1811","https://i.ytimg.com/vi/x8K6L1wr7fs/default.jpg","False","True","Tune in for the next chapter of Destiny 2"
"NwyRbfVRslE","ADDISON RAE SHOCKING NEW HAIRSTYLE | Jeff's Barbershop","2020-06-09T20:24:40Z","UCmraHp1nkUsFWLqR7SWToIg","Jeff Wittek","23","20.10.06","Jeff's barbershop|Jeff wittek|vlog squad|David Dobrik|barber|barbershop|haircut|interview|podcast|addison rae|tiktok|jonah|jason nash|matt king|mike sheffer","1728443","111565","1144","5626","https://i.ytimg.com/vi/NwyRbfVRslE/default.jpg","False","False","This video was shot in may before the events of George Floyd. We didn't feel it was appropriate to put out until now. We still want to use our platform to show our support for the Black Lives Matter movement!https://blacklivesmatters.carrd.coJeff’s Barbershop merch is available now at 👇https://www.fanjoy.co/jeff Follow my Instagramhttps://www.instagram.com/jeffTwitter https://www.twitter.com/jeffwittek People in this vid:Addison Raehttps://www.instagram.com/addisonraeeMike Shefferhttps://www.instagram.com/mikeshefferOutro song bySimon Rexhttps://www.youtube.com/user/dirttothenastyCamera/ EditorOscar Alvahttps://www.instagram.com/oscaralvaAssitant to the assistant EditorJoe Vulpishttps://www.youtube.com/channel/UCJRb6jaNxNjkLfVg_z8VQ3g"
"UY3Px46WFfc","SIDEMEN 70,000 CALORIES CHALLENGE IN LOCKDOWN","2020-06-07T17:00:08Z","UCDogdKl7t7NHzQ95aEwkdMw","Sidemen","24","20.10.06","sidemen|sidemen sunday|#sidemensunday|sidemen calories|calorie challenge","5527035","343979","3264","23633","https://i.ytimg.com/vi/UY3Px46WFfc/default.jpg","False","False","The Sidemen take on the 70,000 calorie challenge as they get to meet up again for the first time since lockdown began!👉🏻 Subscribe to our 2nd Channel: https://www.youtube.com/MoreSidemen 👈🏻👕: Sidemen Clothing: http://www.sidemenclothing.com📸: Sidemen Instagram: http://www.instagram.com/Sidemen🐤: Sidemen Twitter: http://www.twitter.com/Sidemen✏️: SUBMIT A #SidemenSunday IDEA HEREhttps://forms.gle/JDuGrSzM4F6mdo6D9-----------------------------------------------------------------------------------------------------------------------▶️ SIDEMEN ◀️🔴 SIMON (Miniminter)● http://www.youtube.com/Miniminter● http://www.youtube.com/MM7Games● http://www.instagram.com/Miniminter● http://www.twitter.com/Miniminter🔵 JOSH (Zerkaa)● http://www.youtube.com/Zerkaa● http://www.youtube.com/ZerkaaPlays● http://www.instagram.com/Zerkaa● http://www.twitter.com/ZerkaaHD🔴 ETHAN (Behzinga)● http://www.youtube.com/Behzinga● http://www.youtube.com/Beh2inga● http://www.instagram.com/Behzingagram● http://www.twitter.com/Behzinga🔵 VIK (Vikkstar123)● http://www.youtube.com/Vikkstar123● http://www.youtube.com/Vikkstar123HD● http://www.youtube.com/VikkstarPlays● http://www.instagram.com/Vikkstagram● http://www.twitter.com/Vikkstar123🔴 TOBI (Tobjizzle)● http://www.youtube.com/TBJZL● http://www.youtube.com/Editingaming● http://www.instagram.com/Tobjizzle● http://www.twitter.com/Tobjizzle🔵 JJ (KSI)● http://www.youtube.com/KSI● http://www.youtube.com/KSIOlajidebtHD● http://www.instagram.com/KSI● http://www.twitter.com/KSIOlajidebt🔴 HARRY (W2S)● http://www.youtube.com/W2S● http://www.youtube.com/W2SPlays● http://www.instagram.com/Wroetoshaw● http://www.twitter.com/Wroetoshaw"
"VugFm2zy3Gk","DAZ WATCHES CHEAPSKATE WRESTLER WHO LIVES WITH MUM","2020-06-09T17:00:17Z","UCDBCCMlFD-hArPbWv38FINA","Daz Games","24","20.10.06","Daz|games|daz|watches|CHEAPSKATE|DAZ WATCHES|DAZ GAMES|FUNNY|COMEDY|LAUGH|VLOG|VIDEO|REACTION","335529","36588","157","3722","https://i.ytimg.com/vi/VugFm2zy3Gk/default.jpg","False","False","MERCH : https://dazblackshop.com/TWITTER : https://twitter.com/daz_blackINSTAGRAM : http://instagram.com/daz_blackDaz Black : http://bit.ly/2daMcU3FACEBOOK : http://bit.ly/1QsBu0ZSNAPCHAT : daz_blackDino PC : https://www.dinopc.com/Buisness : dazblack@independenttalent.comPC specs: http://bit.ly/2y388Z3Capture Sofware: XsplitMonitor x2: http://amzn.to/2xlwvNLSpeakers: http://amzn.to/2xl9aM0"
"vuj5MoM2i9s","I Have Tourettes | The Secret Life of Lele Pons","2020-06-09T16:00:13Z","UCi9cDo6239RAzPpBZO9y5SA","Lele Pons","24","20.10.06","lele|lele pons|shots|shots studios|hannah stocking|howie mandel|ocd|obsessive compulsive disorder|tourettes|tourettes syndrome|mental health|mental illness|wellbeing|lgbt|gay|vine|viner|tik tok|creator|youtuber|influencer|latin|latina|latino|latinx|hispanic|venezuela|therapy|rudy mancuso|anwar jibawi|juanpa zurita|James Charles Instant Influencer|depression|adhd|lgbtq|tik tok trends|latin music|celoso|volar|bloqueo|vete pa la|dicen","983093","80647","6325","5416","https://i.ytimg.com/vi/vuj5MoM2i9s/default.jpg","False","False","New Free Episodes Every Tuesday at 9am PST / 12pm EST Watch Episodes Here ▶ https://www.youtube.com/watch?v=USfoQp_Py4I&list=PLmjMRs-v1tgRvIN1rqT2x35S2F5QvTW_jThey say it takes a village and lucky for Lele, she has a strong support team who helps her through each day allowing her to flourish in her career yet always put working on herself first. With the recent onset of motor and vocal tics, Lele acknowledges that what she experienced as a 11 year old is now back and she is challenged both personally and professionally living with Tourette Syndrome.If you or someone you know needs help, find resources in your area from the Tourette Association of America: https://tourette.org/resources/overview/International resources are also available:  https://tourette.org/about-us/partner-network/international/Produced by: Shots StudiosDirected by: Alicia Zubikowski"
"h-5S82ETKvI","Destiny 2: Beyond Light – Reveal Trailer","2020-06-09T16:14:01Z","UC52XYgEExV9VG6Rt-6vnzVA","destinygame","20","20.10.06","Destiny|destiny 2|beyond light|trailer|stranger|eris morn|the drifter|europa|darkness|expansion|bungie|sony|ps4|xbox|xbox one|ps5|xbox series x|stadia|games|gaming|mmo|fps","466802","16237","640","1611","https://i.ytimg.com/vi/h-5S82ETKvI/default.jpg","False","False","A new power is born out of the ancient Pyramid ship above Europa's frozen frontier, and a dark empire has risen beneath, united under the banner of the Fallen Kell of Darkness, Eramis. Join your fellow Guardians and bring down the empire at any cost – even if it means wielding the Darkness itself.As the new threat emerges, so too does a mysterious new power – Stasis. Rooted in Darkness, Guardians will wield this new elemental power alongside Arc, Solar, and Void to dominate the battlefield. Titans, Warlocks, and Hunters each use Stasis in a different way, from slowing down foes with Stasis fields to encasing and shattering enemies with destructive might.  Pre-Order Beyond Light: bung.ie/BeyondLight FOLLOW DESTINY:Facebook: https://www.facebook.com/DestinyTheGameTwitter: https://www.twitter.com/destinythegameInstagram: https://www.instagram.com/destinythegameDiscord: http://www.discord.gg/destinygame FOLLOW BUNGIE:Facebook: https://www.facebook.com/Bungie/Twitter: https://www.twitter.com/bungieInstagram: https://www.instagram.com/bungie/⠀ ⠀ ⠀ ⠀ Dive into the free-to-play world of Destiny 2 to experience responsive first-person shooter combat, explore the mysteries of our solar system, and unleash elemental abilities against powerful enemies. Create your Guardian and collect unique weapons, armor, and gear to customize your look and playstyle. Experience Destiny 2’s cinematic story alone or with friends, join other Guardians for challenging co-op missions, or compete against them in a variety of PvP modes."
"A73HqRmulY0","👑 | MizOrMac - Return Of The Mac - REACTION","2020-06-09T16:30:44Z","UC4lb0YsApH03hdApNLvprow","Dan&Kaz","24","20.10.06","miz|mizormac|return|of|the|mac|return of the mac|mizormac - return of the mac|mizormac return of the mac|mizormac reaction|mizormac war|mizormac kent nizzy|mizormac drill|drill|uk drill|mizzy|miz return of the mac|spartan supreme|spartans supreme|dilligent|dan&kaz|mizormac return of the mac dan and kaz|MIZ OR MAC|harlem spartans|loski|harlem|blanco|grm|grime|spartans|the return of the mac|nyge|dan|kaz|grm daily|and|music","52669","5046","33","611","https://i.ytimg.com/vi/A73HqRmulY0/default.jpg","False","False","Welcome back to another reaction video!MizOrMac - Return Of The MacITS THE RETURN OF THE MAC!!! This one means a lot to us, if you’re new to this scene you just wouldn’t understand. This return was so awaited, an we really look forward to what else Miz has coming.Link to the original video: https://youtu.be/zE0vK31wQQQOUTRO - https://soundcloud.com/straight3/romy...Also if you guys would like us to do more challenges/vlogs please comment down below!FOLLOW OUR SOCIALS FOR SOME BEHIND THE SCENES CONTENT!!! INSTA 📸 : - @dan_osi - @kazidris SNAPCHAT 👻 : - @afd14 - @kazem98*Copyright Disclaimer Under Section 107 of the Copyright Act 1976, allowance is made for fair use for purposes such as criticism, comment, news reporting, teaching, scholarship, and research. Fair use is a use permitted by copyright statute that might otherwise be infringing. Non-profit, educational or personal use tips the balance in favor of fair use. No copyright infringement intended. ALL RIGHTS BELONG TO THEIR RESPECTIVE OWNERS*"
"v4ShRREe26w","PE With Joe | Tuesday 9th June","2020-06-09T08:38:58Z","UCAxW1XT0iEJo0TYlRfn6rYQ","The Body Coach TV","17","20.10.06","[none]","344300","10095","413","601","https://i.ytimg.com/vi/v4ShRREe26w/default.jpg","False","False",""
"LSFV3jstmgQ","Testing the CHEAPEST (Worst) Drinking Games from Wish","2020-06-09T19:02:07Z","UCfbnTUxUech4P1XgYUwYuKA","Cold Ones","23","20.10.06","wish.com|opening wish items|opening wish products|opening wish mystery boxes|opening wish stuff|maxmoefoe|anything4views|unboxing|opening wish bootleg items|bootleg|opening toys|wish.com scam|wish scam|reviewing stuff from wish|wish.com haul|wish haul video|opening free wish items|weird things from wish|weird products|wish products|wish box|mystery box|ebay box|weird things from ebay|reviewing ebay items|opening bootleg toys|strange things from wish","422670","39237","276","1674","https://i.ytimg.com/vi/LSFV3jstmgQ/default.jpg","False","False","We bought Cheap Drinking Games from China and Punished our Bodies with them! 🌈BUY THE CLOTHES WE'RE WEARING! 10% OFF w/ code COLDONES 👉 https://bit.ly/coolcloth🎬SUPPORT US ON PATREON FOR BONUS CONTENT: https://patreon.com/coldones _______________________________________________________________SEND STUFF TO OUR PO BOX:Cool ShirtzParcel Locker 10168 81071 208 Riversdale RoadHAWTHORN VIC 3122_______________________________________________________________SOCIAL MEDIA LINKSTwitter - https://twitter.com/ColdOnesReddit -  https://www.reddit.com/r/coldonesDiscord - https://discord.gg/nTHhPpc_______________________________________________________________THE BOYS' SOLO CHANNELSChad - https://www.youtube.com/channel/UC0kYGyq4kzEAoolkOA6JhAAMax - https://www.youtube.com/user/maxmoefoePokemon_______________________________________________________________#Wish #Funny #Games"
"g2CIFAo6z1w","KATIE PRICE: MY MUCKY MANSION HELL PART I","2020-06-09T16:00:24Z","UCgWFC7cvQMoFP9WY1sx75cw","Katie Price","24","20.10.06","Katie|Katie Price|Harvey Price|Reality TV|Quest|KP|Pricey|Jordan|Junior Andre|Quest RED|Mucky mansion|Cowboy builders|builders|House|Home|Redevelopment|House redevelopment|Katie price home|Katie price house|House tour|The Sun|Daily Mail|The Mirror|OK|Tour|Tabloid|Celebrity|I'm a celebrity get me out of here|Peter andre|Katie price funny moments|Katie price sad moments|Katie price charity","81377","3693","188","205","https://i.ytimg.com/vi/g2CIFAo6z1w/default.jpg","False","False","Hey Guys!In this video see me take a trip down memory lane! In this 3 part series I return to my old house, in what the papers call my ‘Mucky Mansion’. In this series, I go through the highs and lows of my career, and my plans for the future!SUBSCRIBE FOR MORE GREAT KATIE PRICE CONTENT! https://bit.ly/3bamerzFOLLOW MY SOCIALSKatie's Instagram: @katiepriceKatie's Twitter: @KatiePrice-Music - Epidemic Sound"
"O1ALIgizTcc","Gorillaz – Friday 13th ft. Octavian (Episode Four)","2020-06-09T16:00:11Z","UCfIXdjDQH9Fau7y99_Orpjw","Gorillaz","1","20.10.06","[none]","663490","84749","4397","7250","https://i.ytimg.com/vi/O1ALIgizTcc/default.jpg","False","False","Gorillaz present Song Machine | Season OneEpisode Four: Friday 13th ft. OctavianFollow your nearest Song Machine: https://gorill.az/songmachineHit subscribe now (snooze you lose) Follow Gorillaz:https://instagram.com/gorillazhttps://twitter.com/gorillazhttps://facebook.com/gorillazhttps://gorillaz.com [CREDITS]Director: Jamie HewlettCo-Directors: Tim McCourt & Max TaylorProducer: Eva DahlqvistAnimation: Venla LinnaShadow Animation: Eleonora QuarioClean Up Artists: Setareh Seto, Venla LinnaCompositors: Courtney Pryce, Valerie GuichardProduction Manager: Samia AhmedProduction Assistant: Laurence Moss Gorillaz are managed by Eleven Management"
"Bi5FxqxmekY","MY NEW DRIVER","2020-06-09T19:22:27Z","UCFHZHhZaH7Rc_FOMIzUziJA","Rick Shiels Golf","17","20.10.06","Golf|Golf Tips|Golf Advice|How to play better golf|Rick Shiels PGA|Rick Shiels golf|review club lesson|Golf lessons|Manchester|Rick Shiels PGA Golf Coach|Online golf|facebook golf|twitter golf|rickshielspga|rickshielsgolf|tiger|woods|Rory Mcilroy|Stop slicing|stop hooking|how to play golf|improve ball striking|stop shanks|reduce handicap|become a better golfer|Golf balls|Titleist|Callaway|Taylor Made|Ping","289384","12894","215","1712","https://i.ytimg.com/vi/Bi5FxqxmekY/default.jpg","False","False","MY NEW GOLF DRIVERIn this video PGA GOLF PROFESSIONAL Rick Shiels tests loads of new drivers from 2019 and 2020 to see which driver can replace his beloved Cobra F9 Driver which Rick names THE DRIVER TO BEAT IN 2019Rick Shiels tests and reviews the TaylorMade Sim Driver, TaylorMade Sim Max Driver, Callaway Mavrik Driver, Callaway Mavrik SubZero Driver, Mizuno ST200 Driver, Mizuno ST200 G Driver, Mizuno ST200 X Driver, Ping G410 Max Driver, Ping G410 LST Driver, Titleist TS2 Driver, Titleist TS3 Driver, Cleveland Launch HB Driver, Cobra Speedzone Driver, Cobra Speedzone Xtreme Driver, Tour Edge Exotics Driver to see which driver Rick Shiels puts in his golf bag, the driver that makes Rick feels more confidence and comfortable and offers the most forgiveness, distance, best sound, best feel and helps Rick find more fairways....HOPEFULLY►Become a FREE SUBSCRIBER to RICK SHIELS now http://bit.ly/SubRickShielsGolf► Official Apparel and footwear partner: Nike Golf http://www.nike.com/golf►Official Garmin Ambassador: https://explore.garmin.com/en-GB/golf/► Hit #Subscribe & #HitTheBell so you don't miss out on any new videos! -----------------------------------------------------------------------------------►My Links:Facebook  ► https://www.facebook.com/RickShielsPGA/Twitter       ► http://bit.ly/RickShielsTwitterInstagram ► http://bit.ly/RickShielsIGWeb           ► http://www.rickshielsgolf.co.uk/---------------------------------------------------------------------------------Hi I’m Rick Shiels, welcome to my channel RickShielsPGAGolf. This YouTube channel is designed to help you play better golf, also to help you enjoy your golf more! I specialise in golf club reviews, golf club unboxing, golf club news, golf club head to heads, and all about golf clubs. I also want to make you play better golf by providing coaching video on all topics about golf, how to fix your slice, fix your hook, help you drive the golf ball longer, hit your irons more pure, hit your irons closer to the hole and help you draw and fade your golf shots. I will also help you lower your score by chipping better by stopping you duff and thin chips, pitch the ball closer and also create backspin. Also I will provide you help to putt better and hole more putts! On this channel I also make fun and entertaining golf content based on crazy and sometimes “gimmicky” golf clubs. I like to cut through the marketing hype about products and I like to give you the honest truth about golf equipment. If you enjoy the channel make sure you hit subscribe and also tap the notification bell so that you are always notified when I release a new video."
"eUCVRF6hjSQ","WayV 威神V 'Turn Back Time (超时空 回)' MV","2020-06-09T16:50:46Z","UCEf_Bc-KVd7onSeifS3py9g","SMTOWN","10","20.10.06","[none]","3718368","765518","3540","123789","https://i.ytimg.com/vi/eUCVRF6hjSQ/default.jpg","False","False","WayV's 1st album Awaken The World is out!Listen and download on your favorite platform: https://smarturl.it/WayV_AwakenTheWorld[Tracklist]01 Turn Back Time02 Bad Alive03 Unbreakable04 After Midnight05 Interlude: Awaken The World06 Only Human07 Domino08 Up From Here09 Electric Hearts10 Stand By MeWayV Officialhttps://www.weibo.com/WeiShenVhttps://www.youtube.com/c/wayvhttps://www.facebook.com/WayV.officialhttps://www.instagram.com/wayvofficialhttps://twitter.com/wayv_official#WayV #TurnBackTime #超时空回 #威神V #WeiShenVWayV 威神V 'Turn Back Time (超时空 回)' MV ℗ SM Entertainment, LABEL V"
"Ms90okhAbTw","Destiny 2: Beyond Light – Gameplay Trailer","2020-06-09T16:17:54Z","UC52XYgEExV9VG6Rt-6vnzVA","destinygame","20","20.10.06","Destiny","281485","9616","265","1227","https://i.ytimg.com/vi/Ms90okhAbTw/default.jpg","False","False","Description:The splintered houses of the Fallen have rallied and built their new empire on the icy moon of Europa. Brave the unrelenting glacial frontier, infiltrate the Golden Age Braytech facility, and uncover the secrets that lie deep under the ancient ice. Pre-Order Beyond Light: bung.ie/BeyondLight ⠀FOLLOW DESTINY:Facebook: https://www.facebook.com/DestinyTheGameTwitter: https://www.twitter.com/destinythegameInstagram: https://www.instagram.com/destinythegameDiscord: http://www.discord.gg/destinygame FOLLOW BUNGIE:Facebook: https://www.facebook.com/Bungie/Twitter: https://www.twitter.com/bungieInstagram: https://www.instagram.com/bungie/⠀ ⠀ ⠀ ⠀ Dive into the free-to-play world of Destiny 2 to experience responsive first-person shooter combat, explore the mysteries of our solar system, and unleash elemental abilities against powerful enemies."
"Z5egNHyiKLA","WATCH: George Floyd private funeral in Houston","2020-06-10T00:08:02Z","UCDmNmxF3ZVMeGyvWE9tOqPQ","ABC13 Houston","25","20.10.06","george floyd|george floyd houston|george floyd funeral houston","336854","4913","1327","342","https://i.ytimg.com/vi/Z5egNHyiKLA/default.jpg","False","False","Today, a final, private farewell will be held for George Floyd. The ceremony at the Fountain of Praise Church is expected to last several hours. https://abc13.com/6238731/Don't forget to subscribe to our channel.Follow us for more great content!Facebook: https://abc13.co/2HbTdO3Twitter: https://abc13.co/2HzMssVInstagram: https://abc13.co/2Hawi9U"
"eQh4vTtzTEc","PE With Joe | Wednesday 10th June","2020-06-10T08:34:32Z","UCAxW1XT0iEJo0TYlRfn6rYQ","The Body Coach TV","17","20.10.06","[none]","211804","8085","236","197","https://i.ytimg.com/vi/eQh4vTtzTEc/default.jpg","False","False","GET YOUR OWN LIMITED EDITION PE WITH JOE T-SHIRT 😀 **Limited edition PE With Joe T-Shirts Now Available here: https://bit.ly/2VWNkwH **THIS IS THE ONLY PLACE TO BUY AN OFFICIAL PE WITH JOE T-SHIRT**We've created a range of limited edition PE With Joe T-shirts to help raise some money for the NHS.100% of the profits will be donated to the NHS Charities Together.All of the tees are made from 100% organic fairtrade cotton and printed in the UK. Delivery may take 1 - 3 weeks.**Limited edition PE With Joe T-Shirts Now Available here: https://bit.ly/2VWNkwH"
"aS-yUjK2OD8","PS5 - The Future of Gaming","2020-06-08T22:22:38Z","UC-2Y8dQb0S6DtpxNgAKoJKA","PlayStation","20","20.10.06","playstation|playstation news|playstation updates|playstation info|playstation launch|playstation reveal|playstation release date|playstation stream|playstation livestream playstation 5|ps5|ps5 console|playstation 5 console|playstation 5 news|ps5 news playstation 5 updates|ps5 updates|playstation 5 info|ps5 info|ps5 launch|ps5 reveal ps5 release date|playstation 5 launch|playstation 5 reveal|playstation 5 release date|ps5 stream","3596546","141407","5469","11553","https://i.ytimg.com/vi/aS-yUjK2OD8/default.jpg","False","False","Join us for a look at the future of gaming. Watch the live stream June 11 at 1:00 PM (PDT)."
"5tJwLjVfFPc","Destiny 2: Season of Arrivals – Gameplay Trailer","2020-06-09T16:32:26Z","UC52XYgEExV9VG6Rt-6vnzVA","destinygame","20","20.10.06","Destiny","218387","7312","162","763","https://i.ytimg.com/vi/5tJwLjVfFPc/default.jpg","False","False","Description:Fragments of the vanquished Almighty burn in the sky, but celebration is cut short as mysterious Pyramid ships reveal themselves throughout the system. An obscured message emerges from the darkness. Is it a greeting, a threat, or something else altogether? Eris and Zavala call upon you to find out…Learn more:  bung.ie/ArrivalsBUY SHADOWKEEP: bung.ie/BuyFOLLOW DESTINY:Facebook: https://www.facebook.com/DestinyTheGameTwitter: https://www.twitter.com/destinythegameInstagram: https://www.instagram.com/destinythegameDiscord: http://www.discord.gg/destinygame FOLLOW BUNGIE:Facebook: https://www.facebook.com/Bungie/Twitter: https://www.twitter.com/bungieInstagram: https://www.instagram.com/bungie/⠀ ⠀ ⠀ ⠀ Dive into the free-to-play world of Destiny 2 to experience responsive first-person shooter combat, explore the mysteries of our solar system, and unleash elemental abilities against powerful enemies. Create your Guardian and collect unique weapons, armor, and gear to customize your look and playstyle. Experience Destiny 2’s cinematic story alone or with friends, join other Guardians for challenging co-op missions, or compete against them in a variety of PvP modes."
"zE0vK31wQQQ","MizOrMac - Return Of The Mac","2020-06-07T19:00:10Z","UCOGj6wp7V-gZnbTlmyXcAtw","Spartans Supreme","10","20.10.06","MizorMac|Nyge|Drill|Harlem|Harlem Spartans|Return Of The Mac","582929","41701","386","3677","https://i.ytimg.com/vi/zE0vK31wQQQ/default.jpg","False","False","Download and stream 'Return Of The Mac' here:https://levelmusic.lnk.to/nQgf0L -----Directed by Akash BaggaProduced by Nyge-----🚨 Subscribe to the official channel: https://www.youtube.com/spartanssupreme 📲 Follow MizOrMachttp://www.instagram.com/mizormachttp://www.twitter.com/mizormacSnapchat - mizzy1up"
"BAN-IU4weBM","Falling - A Minecraft Music Video ♪","2020-06-09T12:00:12Z","UCIGl_6GmKR7fPRBBDDRcR0Q","Rainimator","1","20.10.06","minecraft|minecraft song|minecraft parody|minecraft video|minecraft animation|rainimator|minecraft music video","741705","80256","1393","16710","https://i.ytimg.com/vi/BAN-IU4weBM/default.jpg","False","False","Falling - A Minecraft Music VideoThe Netherbane are on the hunt for those who were turned into Nether kin. As Rain tries to use the situation to form an alliance, Stella runs to the Mystic Forest to find closure with the late End Dancer.Song - Falling by Blacklite District:https://www.youtube.com/watch?v=qLs1jUgatBMDirected and animated by RainimatorAssistant animators:DanoBadi https://twitter.com/DanoBadiMCQCAnimations https://twitter.com/QCAnimationsSet designer:CrossMight Arda https://twitter.com/CrossMightSpecial thanks:MrMichael https://twitter.com/michal121345acorn https://twitter.com/acornanimXEliteXCraftersX  https://twitter.com/EliteX1XCrafterKamatayan https://twitter.com/kamatayanFX👾 Rainimator Discord: https://discord.gg/8cdFS3A~Follow me~Twitter: https://twitter.com/rainolaguerInstagram: https://instagram.com/radapedaxa"
"AUS-TaE1kBw","I Tested VIRAL TikTok Life Hacks to see if they work","2020-06-08T18:58:39Z","UCpB959t8iPrxQWj7G6n0ctQ","SSSniperWolf","24","20.10.06","sssniperwolf|sniper wolf|reacting|reaction|funny|life hacks|tiktok hacks|tiktok|tik tok|diy|do it yourself|to|see|if|they|work|tiktok life hacks|life hack","3048712","118803","2217","12459","https://i.ytimg.com/vi/AUS-TaE1kBw/default.jpg","False","False","I Tested VIRAL TikTok Life Hacks to see if they work! Today we're trying these diy lifehacks to see them in action. Leave a Like if you enjoyed! Watch the last one https://youtu.be/QtldQK3QgS4 Subscribe to SSSniperWolf to join the Wolf Pack http://bit.ly/SubSSSniperWolfInstagram: http://instagram.com/sssniperwolfTwitter: http://www.twitter.com/sssniperwolfFacebook: https://www.facebook.com/sssniperwolfvideosOfficial Merch: https://ogwolfpack.com/"
