video_id,title,publishedAt,channelId,channelTitle,categoryId,trending_date,tags,view_count,likes,dislikes,comment_count,thumbnail_link,comments_disabled,ratings_disabled,description
"uX9G5Lk3Rnk","Cheers as Bristol protesters pull down statue of 17th century slave trader","2020-06-07T17:17:25Z","UCIRYBXDze5krPDzAEOxFGVA","Guardian News","25","20.10.06","bristol|statue|bristol statue|slave trader|protest|blm|uk|black lives matter|black lives matter protests|i cant breathe|blm coronavirus|race|racism|black lives matter uk|us|blm uk|george floyd|anti-racist|Edward Colston|Edward Colston statue|slave|slavery|slave trade|slave trade statue|2020|slave trade statue bristol|statue pulled down|statue pulled down bristol|guardian|news|police|colston|edward colston bristol|bristol statue pulled down|torn down|floyd","345847","4928","3408","0","https://i.ytimg.com/vi/uX9G5Lk3Rnk/default.jpg","True","False","Black Lives Matters protesters in Bristol have pulled down a statue of the slave trader Edward Colston, whose company transported more than 100,000 slaves from West Africa to the Caribbean and the Americas between 1672 and 1689. Demonstrators attached a rope to the Grade II-listed statue, pulled it down and rolled it into the city's harbour. It follows the toppling of several Confederate statues during Black Lives Matter protests in the USSubscribe to Guardian News on YouTube ► http://bit.ly/guardianwiressubBLM protesters topple statue of Bristol slave trader Edward Colston ► https://www.theguardian.com/uk-news/2020/jun/07/blm-protesters-topple-statue-of-bristol-slave-trader-edward-colstonGeorge Floyd protests: latest coverage ► https://www.theguardian.com/us-news/live/2020/jun/07/george-floyd-protests-anti-racism-demonstrations-donald-trump-black-lives-matter-live-updatesSupport the Guardian ► https://support.theguardian.com/contributeToday in Focus podcast ► https://www.theguardian.com/news/series/todayinfocusThe Guardian YouTube network:The Guardian ► http://www.youtube.com/theguardianOwen Jones talks ► http://bit.ly/subsowenjonesGuardian Football ► http://is.gd/guardianfootballGuardian Sport ► http://bit.ly/GDNsportGuardian Culture ► http://is.gd/guardianculture"
"1JESMVI3D8g","Trying Those PolyGel Nails @ Home","2020-06-07T19:11:35Z","UCZ1Pvkj6KxOvf6FElElCvyQ","Mackenzie Marie","24","20.10.06","Trying polygel nails|diy polygel nails at home|trying polygel nails for the first time|I tried polygel nails and this is what happened|beauty|diy|nails|nail art|diy manicure|diy acryilcs|doing my own acrylics at home|testing a polygel kit|doing my own polygel nails","260057","15878","253","1705","https://i.ytimg.com/vi/1JESMVI3D8g/default.jpg","False","False","Trying an At-Home Polygel Nail ManicureLike & SubscribeFollow me On Instagram @mackenziemmarieHad to try this out at home to see if it actually really worked. Let me know what you think in the comments below.Love ya-Kenziefollow me on instagram @mackenziemmariefollow me on twitch @mackenziemmariefollow me on tiktok @mackenziemarieofficialfollow me on twitter @mackenziiemarie  Business inquires email mackenziemariebusi@outlook.com"
"SUS75CP69OY","My MUM Asks Me Questions YOUR PARENTS Are Too Afraid To Ask YOU!","2020-06-07T09:00:07Z","UCwR-g7XxcLxjYVTS5qncFhg","Anastasia Kingsnorth","24","20.10.06","[none]","510710","33429","337","1743","https://i.ytimg.com/vi/SUS75CP69OY/default.jpg","False","False","My MUM Asks Me Questions YOUR PARENTS Are Too Afraid To Ask YOU!Business Email: anastasiakingsnorth@mcsaatchisocial.comPODCAST: https://browse.entale.co/show/0a8f5f52-184a-40d8-af7d-419bbe3432ddFavourite products:Benefit 24 Hour Brow Setter - https://www.benefitcosmetics.com/uk/en-gb/product/24-hr-brow-setter-clear-brow-gel#full&sku=BM66PO Box: Anastasia KingsnorthC/O M&C Saatchi Social36 Golden SquareLondonW1F 9EEDisclaimer - I am not trying to brag, all opinions are my own. I will state in the video and in the description if the video is sponsored by a brand or company.Links:Instagram - www.instagram.com/anastasiakingsnorthTwitter - www.twitter.com/AnastasiaK_xoxoFacebook - www.facebook.com/AnastasiaKingsnorthSocial Snapchat - anastasiaa3xoTiktok - @anastasiakingsnorthxoxo,Anastasia"
"BkFaW7Ed2Ew","Happy 80th Birthday to Sir Tom Jones! | The Voice UK","2020-06-07T06:15:00Z","UCOlLivh3_AfkjDFy5X7EL5Q","The Voice UK","24","20.10.06","the voice coaches|the voice uk|Meghan Trainor|will.i.am|william|tom jones|olly murs|the voice of uk|the voice itv|tv talent|the voice best moments|the voice performance|la voiz|aj odudu|emma willis|the voice uk 2020|the voice uk 2020 highlights|tom jones performance|tom jones the voice|tom jones performing|tom jones it's not unusual","182011","3698","51","0","https://i.ytimg.com/vi/BkFaW7Ed2Ew/default.jpg","True","False","In honour of Sir Tom Jones' 80th Birthday, relive some of the legendary Coach's best moments from The Voice UK.Subscribe, like and watch more: http://bit.ly/2jmXcPtWebsite: http://bit.ly/2hwvvllFacebook: http://bit.ly/2iuiAyQTwitter: http://bit.ly/2ht0H1rInstagram: http://bit.ly/2iIEy0qDownload The Voice UK's free app for exclusive previews and news:iOS: http://apple.co/2hzvKxqAndroid: http://bit.ly/2iJbRo3Get all the latest from The Voice UK YouTube channel, news, gossip and videos with superstar Coaches will.i.am, Meghan Trainor, Olly Murs and Sir Tom Jones.http://www.itv.comhttp://www.stv.tv #TheVoiceUK"
"GpSqjclE4rI","LIVE: Black Lives Matter protest in London sparked by George Floyd's killing","2020-06-07T20:38:58Z","UC5aeU5hk31cLzq_sAExLVWg","Ruptly","25","20.10.06","news|ruptly","100581","0","0","0","https://i.ytimg.com/vi/GpSqjclE4rI/default.jpg","True","True","Subscribe to our channel! rupt.ly/subscribeRuptly is live from London on Sunday, June 7, as people gather for a protest against police brutality and racial discrimination two weeks after the killing of George Floyd.The 46-year old black man lost his life at the hands of a police officer in the US city of Minneapolis on May 25.Massive protests erupted across the US following the incident and some other countries. The officer who knelt on Floyd was arrested and charged with third-degree murder and manslaughter on Friday, while protesters demand the arrest of other three officers involved.Video on Demand: http://www.ruptly.tvContact: cd@ruptly.tvTwitter: http://twitter.com/RuptlyFacebook: http://www.facebook.com/Ruptly"
"NihFxWjFNCo","ASKING MY LIL BRO QUESTIONS GIRLS ARE TOO AFRAID TO ASK GUYS! | Syd and Ell","2020-06-07T09:00:12Z","UCTOqGA8U2Ms7AuRkMW6T08g","SYDANDELL","1","20.10.06","asking|my|brother|questions|girls|are|too|afraid|to|ask|little|bro|lil|guys|on|the|spot|quick|fire|truth|honest|bum|boobs|firstdates|firstimpressions|onedge|embarassing|funny|jokes|laughing|notserious|turnons|turnoff","139997","8958","69","235","https://i.ytimg.com/vi/NihFxWjFNCo/default.jpg","False","False","Sending our love to you all.. comment some video suggestions! STAY SAFE XXXXXFollow Joel! JOELCROUCHMakeup SYD AND ELL wear day to day:Syd-Foundation: MAC face & body https://rstyle.me/cz-n/d3kwd9cc3pxConcealer: Giorgio Armani https://rstyle.me/cz-n/d3kwgvcc3pxIlluminator strobe cream -  https://rstyle.me/cz-n/d5mekzcc3pxBenefit gimme brow: https://www.benefitcosmetics.com/uk/en-gb/product/gimme-brow-volumising-eyebrow-gel?utm_source=yt&utm_medium=pr&utm_campaign=SydEllBrowHeros&utm_content=VlogBenefit brow gel: https://www.benefitcosmetics.com/uk/en-gb/product/24-hr-brow-setter-clear-brow-gel#full&sku=BM12?utm_source=yt&utm_medium=pr&utm_campaign=SydEllBrowHeros&utm_content=Vlog Benefit precisely my brow pencil: https://www.benefitcosmetics.com/uk/en-gb/product/precisely-my-brow-eyebrow-pencil?utm_source=yt&utm_medium=pr&utm_campaign=SydEllBrowHeros&utm_content=VlogBlush: Nars https://rstyle.me/cz-n/d3kwnacc3pxBronzer: Estée Lauder https://rstyle.me/cz-n/d3kzspcc3pxL’Oréal  Paradise mascara - https://rstyle.me/cz-n/d5mee7cc3pxMac lip liner shade hover - https://rstyle.me/cz-n/d44j5fcc3pxGloss (fenty glow) - https://rstyle.me/cz-n/d5mei5cc3pxEll-Nars tinted booster glow  https://rstyle.me/cz-n/d3kq5gce4nf  mixed with mac face and body https://rstyle.me/cz-n/d3kq3hce4nf Giorgio Armani concealer https://rstyle.me/cz-n/d3kq8tce4nfLaura mercier setting powder  https://rstyle.me/cz-n/d3kraace4nf Benefit gimme brow in shade 3 https://www.benefitcosmetics.com/uk/en-gb/product/gimme-brow-volumising-eyebrow-gel?utm_source=yt&utm_medium=pr&utm_campaign=SydEllBrowHeros&utm_content=VlogBenefit 24 gel setter https://www.benefitcosmetics.com/uk/en-gb/product/24-hr-brow-setter-clear-brow-gel#full&sku=BM12?utm_source=yt&utm_medium=pr&utm_campaign=SydEllBrowHeros&utm_content=Vlog  Benefit precisely my brow pencil https://www.benefitcosmetics.com/uk/en-gb/product/precisely-my-brow-eyebrow-pencil?utm_source=yt&utm_medium=pr&utm_campaign=SydEllBrowHeros&utm_content=VlogBenefit roller lash mascara https://rstyle.me/cz-n/d3kra5ce4nfNyx brown liner https://rstyle.me/cz-n/d3krbxce4nfMarc Jacobs bronzer  https://rstyle.me/cz-n/d3krkpce4nfStila cream blush https://rstyle.me/cz-n/d3kripce4nfLaura geller highlight https://rstyle.me/cz-n/d3krg2ce4nf LA girl lip liner in creme nude https://rstyle.me/cz-n/d3krrbce4nfFenty lip gloss in fussy https://rstyle.me/cz-n/d3krmuce4nfFOLLOW US ON SOCIALS!!!SYD'S Twitter - twitter.com/sydneycrouchInstagram - @sydneymaycrouchSnapchat - sydneycrouch ELL'STwitter - twitter.com/elliejarrett2Instagram - @elliejarrett2Snapchat - elliejarrett2 #sydandell"
"DiZNegOugWM","Aaron Kaufman Builds 1200 HP FERRARI TWIN TURBO F12 for DDE: Episode 1","2020-06-06T14:00:07Z","UCj_ARBxhCoF5JxUItcEUs7Q","DailyDrivenExotics","2","20.10.06","Aaron Kaufman|Arclight Fab|Dean Kearney|Team Karnage|Formula Drift|Drift Viper|Drift Ferrari|Twin Turbo Ferrari F12|Twin Turbo V12|Daily Driven Exotics|Lamborghini|Exotic Rental Car|Rental Car|Lamborghini Huracan|Drifting|Burnouts|Supercar|Porsche|McLaren|Bugatti|Pagani|Koenigsegg|Ferrari|Audi R8|Mercedes Benz|Amg|Fast and Loud|Gas Monkey Garage","915147","39969","1100","2481","https://i.ytimg.com/vi/DiZNegOugWM/default.jpg","False","False","WATCH DDE on Facebook https://bit.ly/DDEfacebook FOLLOW Aaron Kaufman https://bit.ly/TheArclight FOLLOW ArcLight Fab https://bit.ly/ArcLightFab FOLLOW DDE http://bit.ly/DDEinstaBEVERLY HILLS POLICE USE UNLAWFUL INTIMIDATION TACTICS ON LAMBORGHINI OWNERhttps://youtu.be/3dqeZq1wJ6kBEVERLY HILLS POLICE UNLAWFUL CITATION IMPOUNDS LAMBORGHINI OWNER https://youtu.be/KDMp6M-P7vcYOU WONT BELIEVE WHY THIS COP PULLS ME OVER! *Most Ridiculous Ticket In A Lamborghini* https://youtu.be/-Xx2ehfBQVMYou WONT BELIEVE WHY He Pulled Over! https://youtu.be/hF-JuU9kWcULaguna Police Ticket Lamborghini Passenger WE'RE IN TROUBLE https://youtu.be/s_jE-1rvdmILamborghini Pulled Over By Oregon State Police https://youtu.be/AcRpHatyqJAWE TOUR FAST & FURIOUS LOCATIONS WITH HECTOR *JOHNNY TRAN DESTROYS ECLIPSE*  https://youtu.be/1xlV048zqEgWE TOUR FAST & FURIOUS LOCATIONS WITH JESSE IN LA! *OVERNIGHT PARTS FROM JAPAN* https://youtu.be/KVaeet7vgGIWE TOUR FAST & FURIOUS LOCATIONS IN LA! TUNA, NO CRUST https://youtu.be/7NAi03QMR0g"
"UXWRy4TzrBc","Van De Beek Wants United Move! Man Utd Transfer News","2020-06-08T09:30:09Z","UCMmVPVb0BwSIOWVeDwlPocQ","The United Stand","24","20.10.06","Manchester United|Man United|Man Utd|Manchester United TV|The United Stand|United Stand|Manchester United News|MUFC|Man Utd News|United|Manchester United 2020|Manchester United Latest News|Manchester United Transfer News|Manchester United Breaking News|Man Utd Transfer News|Transfer News|Transfer|Solskjaer|Ole Gunnar Solskjaer|Solskjaer transfer|Solskjaer news|Van de beek|donny van de beek|van de beek man utd","108581","4136","140","414","https://i.ytimg.com/vi/UXWRy4TzrBc/default.jpg","False","False","Man Utd are leading the race for a Donny Van De Beek transfer with Real Madrid says Ajax's Van Der Sar. Get the latest Man Utd News Now on The United Stand. 🔔 Goldbridge Cooks SUBSCRIBE here https://buff.ly/2GJ5HR7United Stand Exclusive T Shirt collection https://united-stand.myshopify.com/🚨VISIT OUR WEBSITE 🚨For all the latest United news and TUS content:https://www.theunitedstand.com⏲️The United Stand Content TIMELINE is the best way to find all our latest content quickly! https://www.theunitedstand.com/timeline📰 LATEST WRITTEN NEWS https://www.theunitedstand.com/articles/latest-news📸 FOLLOW OUR INSTAGRAMhttps://www.instagram.com/theunitedstandtv/✅ The United Stand MEMBERSHIP https://buff.ly/2I2Of9R📧Contact The United Stand = soccerboxtv@gmail.com📧WRITER SUBMISSIONS = unitedstandwebsite@gmail.comAddressing: Nora CalderSee the FULL United Stand Kit Range CLICK HERE https://buff.ly/2Krpw1zEXCLUSIVE NEW PODCAST ITUNES https://buff.ly/2ZUhv84Spotify https://buff.ly/34dwEo6Google Podcast https://buff.ly/2ZHlNDnCastBox https://buff.ly/2UuiU3RRadio Public https://buff.ly/34jWkzAThe United Stand is Manchester United's biggest independent fan channel. Made for Manchester United fans by Manchester United fans, the United Stand provides you with the latest Manchester United transfer news, highlights, goal reviews and much more. So if MUFC means the world to you, get involved and subscribe to The United Stand http://bit.ly/1CmczHm The United Stand SOCIAL ACCOUNTS:WEBSITE: https://www.theunitedstand.comFACEBOOK: https://www.facebook.com/UnitedStandMUFC/TWITTER: https://twitter.com/UnitedStandMUFCINSTAGRAM! Follow us here https://www.instagram.com/theunitedstandtv/#ManchesterUnited #MUFC"
"rH1vLsqw3Q8","I Tested the Tik Tok Strawberry BUGS Hack with a Microscope","2020-06-06T19:15:00Z","UC6IijBsVf2PlWo_uq6P9wQw","Gloom","24","20.10.06","strawberry bugs|tiktok strawberry bugs|gloom|gloom tries things|kassie|2020|gloomykassie|gloom tries|gloomgames|tiktok strawberry bug|strawberry salt water bugs|strawberry|tiktok bugs in strawberries|salt water and strawberries|how to clean strawberries tiktok|strawberry up close|are there worms in strawberries|insects on strawberry|tiny insects on strawberry|trending videos","1399682","63169","1243","11066","https://i.ytimg.com/vi/rH1vLsqw3Q8/default.jpg","False","False","I don't want to believe there are bugs in my strawberries, so I have a microscope and a dream.SUBSCRIBE HERE: https://www.youtube.com/channel/UC6IijBsVf2PlWo_uq6P9wQw?sub_confirmation=1My INSTAGRAM: http://www.instagram.com/gloomykassieMy TWITTER: http://www.twitter.com/gloomykassieMy DISCORD SERVER (13 and up only): http://discord.gg/GLOOMMERCH: http://gloom.storeWATCH MY HORRIBLE BITLIVES: https://www.youtube.com/watch?v=-RcgvL6bKZQ&list=PLwbhb6Gu7AnXcLWpGMezpMHtPc6MZIfwYMy TIK TOK is @gloomdog, here's a link: http://vm.tiktok.com/JTHb8L/---------------------------------------------------------------------------I'm Kassie, also known as Gloom! I'm a variety gamer who does gameplay commentary on indie games and some bigger titles too. I also do silly sketches, challenges, Q&As, and whatever makes you goof balls giggle.---------------------------------------------------------------------------I do my best to upload at a few times a week (unless my life is a mess)."
"hXkZu4S6Mxo","Carmen de la Salciua - Cat de naiva ma crezi [videoclip oficial] 2020","2020-06-06T10:00:10Z","UCt7Prw97_jb8oAlKnO3oVcQ","Nek Music Tv","10","20.10.06","manele noi","1774457","53970","1714","1377","https://i.ytimg.com/vi/hXkZu4S6Mxo/default.jpg","False","False","Subscribe to NekMusic:http://www.youtube.com/user/nekmusicproductionMuzica Marius de la FocsaniText Marius de la FocsaniOrchestratie Nek MusicVioara  Ninel de la BrailaVideo Silviu Mandroc - Kamarad - Nek Video#carmendelasalciua #hit #manele NekMusic onlinehttps://www.youtube.com/user/nekmusicproductionhttps://www.facebook.com/nekmusicproductionhttp://www.nekmusic.ro/Nek Music Production ® . Contact:nekmusic.ro@gmail.comToate drepturile sunt rezervate. Orice upload neautorizat al acestui videoclip este ilegal si poate fi raportat oricand la Youtube. All rights reserved. Unauthorized reproduction is a violation of applicable laws. In order to avoid copyright infringement, please do not upload this video on your channel."
"4wDrI6jAzL0","MIKEY & JAH Vs. FLIGHT & BRAWADIS!!!","2020-06-07T22:05:35Z","UC-SAFHahv5Nj_O_7keuJNEA","Ryan Razooky Basketball","17","20.10.06","[none]","530307","17016","252","1749","https://i.ytimg.com/vi/4wDrI6jAzL0/default.jpg","False","False","@R2bball on IG & TIK TOKhttps://truespinbasketball.com for the basketballZoom classes https://ryanrazooky.com/zoom-workouts/"
"JHo3V72l8VA","Brave Mama Dog Asks Strangers To Save Her Babies | The Dodo","2020-06-06T20:00:01Z","UCINb0wqPz-A0dV9nARjJlOQ","The Dodo","15","20.10.06","animal video|animals|the dodo|Animal Rescue|dodo|cute animals|pets|wildlife|pet videos|wildlife videos|animals the dodo|the dodo animals|rescuing animals|mama dog|mama dog and puppies|mom dog asks for help|mama dog asks for help|the dodo dogs|dogs|dog rescue|dog stuck in tunnel|dog trapped|trapped dog|puppies|puppy rescue","3482742","112622","826","4942","https://i.ytimg.com/vi/JHo3V72l8VA/default.jpg","False","False","This brave mama dog has been sleeping in a drainpipe. When she saw strangers, she knew she had to ask them to save her babies.To help Dog Rescue Shelter Mladenovac save more animals, you can support them here: http://thedo.do/serbia. Check out more of their rescues on YouTube: http://thedo.do/dogrescueshelterIntroducing Dodo swag!  https://shop.thedodo.com/Love Animals? Subscribe: http://thedo.do/2tv6Ocd¿Hablas español?: https://thedo.do/2BsuN4oFollow The Dodo:Tweet with us on Twitter: https://thedo.do/2Jast1MHowl with us on Musical.ly: https://thedo.do/2qFkbGTTake a peek at our Snapchat: http://thedo.do/2gkVhszLove our Instagram: http://thedo.do/2agAEceLike us on Facebook: http://thedo.do/1dJ9lmnRead more on our site: http://thedo.do/KWDoNtFor the love of animals. Pass it on.#thedodo #animals #dog #cat #kitten #puppy"
"nWesPqp7dTQ","A Day In The Life of Eddie Hall (Worlds Strongest Man) | Training and Eating to Fight The Mountain","2020-06-07T10:39:52Z","UCTuOoT5hhkHYwStFpmchwXQ","Zac Perna","24","20.10.06","Eddie Hall|Zac Perna|Eddie the beast hall|strongman|worlds strongest man|thor|the mountain|boxing|day in the life|strongest man|boxer|bodybuilder|Gymshark|fitness|hafthor|Eddie Hall boxing|Thor boxing|500kg deadlift|500kg|deadlift|deadlift record|arm wrestling","84354","5625","72","907","https://i.ytimg.com/vi/nWesPqp7dTQ/default.jpg","False","False","Hey guys on today's video I go through a day in the life of 2017 worlds strongest man @Eddie 'The Beast' Hall  as he prepares to fight Thor (The Mountain) next year. This Killed me! Hope you guys enjoy! Check Out Eddie's Channel (Vid I referenced): https://www.youtube.com/watch?v=mnZ4ftlifik&t=1153sSubscribe: (http://bit.ly/2x9fzgN), HIT THE NOTIFICATION BELLLet Me Coach You and get your diet and training plan: https://www.jointhemassivefam.zacperna.com.au Shop EHPLabs Supplements :USE ZAC10 at https://www.ehplabs.com/Zac-Perna Shop Gymshark: https://gym.sh/Shop-Zac-Perna2-Follow MeTwitter: @zacpernaInstagram: @zacperna (https://instagram.com/zacperna)Tik Tok: @zacpernaSnapchat Me: zacperna Facebook: https://facebook.com/zacpernafitness-#EddieHall #ZacPernaAbout Zac Perna:I Love Food, Fitness and having a laugh!  Welcome To My Life!•24. Melbourne, Australia [Video Title][Video URL]Zac Pernahttps://www.youtube.com/zeepee4"
"5LH8TewnLY4","Virtual Pub Quiz, Saturday Night 6th of June Live Stream","2020-06-06T20:29:48Z","UCLcSqjJWHJeDWD_SbdorBRw","Virtual Pub Quiz","24","20.10.06","[none]","79347","369","25","16","https://i.ytimg.com/vi/5LH8TewnLY4/default.jpg","False","False","It's another Saturday Night Live Quiz! Always fun on a Saturday night!Live Stream fro 19:50 BST Quiz starts at 20:15 BSTDonate to charity: https://justgiving.com/fundraising/virtualpubquiz2 Facebook: https://www.facebook.com/thevirtualpubquiz/ Twitter: https://twitter.com/TheVirtualPubQ1 Instagram: TheVirtualPubQuiz https://www.instagram.com/thevirtualpubquiz/ Join Patreon: https://www.patreon.com/thevirtualpubquiz #jaysvirtualpubquizThank you so much for your support and messages! Means so muchStay SafeJayMusicbed SyncID:MB01HGYXZJABNBC"
"4ehDRCE1Z38","I’ve Disappointed and Embarrassed Myself.","2020-06-05T18:48:39Z","UCXuqSBlHAE6Xw-yeJA0Tunw","Linus Tech Tips","28","20.10.06","playstation|play|station|ps5|egs|epic|games|store|tim|sweeney|controversy|ssd|solid|state|drive|kraken","3341833","218333","8131","20265","https://i.ytimg.com/vi/4ehDRCE1Z38/default.jpg","False","False","Epic Games CEO Tim Sweeney recently stated that the upcoming Playstation 5 would feature a storage architecture far ahead of anything you can buy on anything on PC for any amount of money right now. Linus initially attacked Sweeney's statement, citing existing SSDs with faster read/write speeds. In this video, Linus explains how he misunderstood Sweeney's statement, apologizes for spreading misinformation, and discusses some of the cool tech that makes the PS5 truly exciting for gamers of all stripes.Buy Playstation stuff:On Amazon (PAID LINK): https://geni.us/fAcMLBOn Newegg (PAID LINK): https://geni.us/rloH0Purchases made through some store links may provide some compensation to Linus Media Group.Discuss on the forum: https://linustechtips.com/main/topic/1205112-i%E2%80%99ve-disappointed-and-embarrassed-myself/GET MERCH: http://www.LTTStore.com/SUPPORT US ON FLOATPLANE: https://www.floatplane.com/  LTX EXPO: https://www.ltxexpo.com/   AFFILIATES & REFERRALS---------------------------------------------------Affiliates, Sponsors & Referrals: https://lmg.gg/sponsorsGet Private Internet Access VPN at https://lmg.gg/pialinus2Get a Mech Keyboard: https://geni.us/RecNBTINEEDforSEAT Gaming Chairs: https://geni.us/needforseatGet a Displate Metal Print at https://lmg.gg/displatelttUse code LINUSMEDIAGROUP on Epic Games Store: https://lmg.gg/kRTpYGet a 30-day free trial of Amazon Prime at https://lmg.gg/8KV1vOur Gear on Amazon: https://geni.us/lmgamazon FOLLOW US ELSEWHERE---------------------------------------------------  Twitter: https://twitter.com/linustechFacebook: http://www.facebook.com/LinusTechInstagram: https://www.instagram.com/linustechTwitch: https://www.twitch.tv/linustechFOLLOW OUR OTHER CHANNELS---------------------------------------------------  Techquickie: https://lmg.gg/techquickieytTechLinked: https://lmg.gg/techlinkedytShortCircuit: https://lmg.gg/shortcircuitytLMG Clips: https://lmg.gg/lmgclipsytChannel Super Fun: https://lmg.gg/channelsuperfunytCarpool Critics: https://lmg.gg/carpoolcriticsytMUSIC CREDIT---------------------------------------------------  Title: Laszlo - SupernovaVideo Link: https://www.youtube.com/watch?v=PKfxmFU3lWYiTunes Download Link: https://itunes.apple.com/us/album/supernova/id936805712Artist Link: https://soundcloud.com/laszlomusicOutro Screen Music Credit: Approaching Nirvana - Sugar High http://www.youtube.com/approachingnirvanaMonitor And Keyboard by vadimmihalkevich / CC BY 4.0 https://lmg.gg/fxHYK Mechanical RGB Keyboard by BigBrotherECE / CC BY 4.0 https://lmg.gg/Q9yyQ Mouse Gamer free Model By Oscar Creativo / CC BY 4.0 https://lmg.gg/8upii"
"i2zpbcW-h-c","Bad Romance (Medieval Style Cover)","2020-06-03T16:00:26Z","UCJ_jwWjf8u5mdtac71Be8QA","Hildegard von Blingin'","10","20.10.06","medieval style|bad romance|lady gaga bad romance acoustic|bad romance medieval style|medieval style music|tavern music|fantasy music|medieval cover|medieval party music","1027190","115758","364","4687","https://i.ytimg.com/vi/i2zpbcW-h-c/default.jpg","False","False","Bad Romance, by Lady Gaga, but medieval/fantasy inspired.Ye have all been exceedingly lovely, a thousand thanks for the support and kind words! I am still new to this, but wanted to actually create my own instrumental this time, so on this track you'll hear a Celtic harp and several wooden recorders I played.Also, I received some wonderful suggestions for the name of this strange genre. Obviously there is plenty of wonderful authentic medieval music out there, but there also seems to be a ravenous demand for old timey covers of modern songs. So far the contenders are: Tavernwave and Bardcore. I love both, and I'd also love to hear your suggestions in the comments.The image is a combination of two pages from the Romance of Alexander in French verse, with illuminations by the Flemish illuminator Jehan de Grise & his workshop, 1338-44 Listen on Soundcloud: https://soundcloud.com/hildegard_von_blinginPS: (For those of you scholarly folk asking, yes thee and me is technically incorrect, which is a nod to the original lyrics by the Lady Gaga)Lyrics:I want thine ugly, I want thy diseaseTake aught from thee shall I if it can be freeI want thy loveLove, love, love, I want thy loveI want thy heartache, the touch of thy handFor weal or woe, I want each kiss in the sandI want thy loveLove, love, love, I want thy loveI want thy love, and all thy lover’s revengeThee and me could write a bad romance I want thy horror, I want thy designThou art a criminal whilst thou art mineI want thy loveLove, love, love, I want thy loveI want thy Nero, thy Bedlam lament,If this is sin then I shall never repent,I want thy loveLove, love, love, I want thy loveI want thy love, and all thy lover’s revengeThee and me could write a bad romance"
